{
  "actor_slot_parameterized": true,
  "after_database_sha256": "aaaaaaaaaaaaaaaaaaaaaaaaaaaaaaaaaaaaaaaaaaaaaaaaaaaaaaaaaaaaaaaa",
  "after_file_mtime_ns": 123456,
  "after_head_sha256": "aaaaaaaaaaaaaaaaaaaaaaaaaaaaaaaaaaaaaaaaaaaaaaaaaaaaaaaaaaaaaaaa",
  "after_lifecycle_fingerprint": "bbbbbbbbbbbbbbbbbbbbbbbbbbbbbbbbbbbbbbbbbbbbbbbbbbbbbbbbbbbbbbbb",
  "before_database_sha256": "aaaaaaaaaaaaaaaaaaaaaaaaaaaaaaaaaaaaaaaaaaaaaaaaaaaaaaaaaaaaaaaa",
  "before_file_mtime_ns": 123456,
  "before_head_sha256": "aaaaaaaaaaaaaaaaaaaaaaaaaaaaaaaaaaaaaaaaaaaaaaaaaaaaaaaaaaaaaaaa",
  "before_lifecycle_fingerprint": "bbbbbbbbbbbbbbbbbbbbbbbbbbbbbbbbbbbbbbbbbbbbbbbbbbbbbbbbbbbbbbbb",
  "dharma_cron_count": 2,
  "excluded_count": 6,
  "execution_supported": false,
  "hermes_count": 59,
  "mutation_count": 0,
  "preview_id": "sab_preview_fixture",
  "records": [
    {
      "actor_slot": "Hermes",
      "eligible": true,
      "evidence_refs": [
        {
          "content_sha256": "0000000000000000000000000000000000000000000000000000000000000000",
          "proof_class": "signed_fixture",
          "ref": "fixture:evidence:0"
        }
      ],
      "exclusion_reason": null,
      "record_id": "seed-00",
      "row_sha256": "0000000000000000000000000000000000000000000000000000000000000000"
    },
    {
      "actor_slot": "Hermes",
      "eligible": true,
      "evidence_refs": [
        {
          "content_sha256": "1111111111111111111111111111111111111111111111111111111111111111",
          "proof_class": "signed_fixture",
          "ref": "fixture:evidence:1"
        }
      ],
      "exclusion_reason": null,
      "record_id": "seed-01",
      "row_sha256": "1111111111111111111111111111111111111111111111111111111111111111"
    },
    {
      "actor_slot": "Hermes",
      "eligible": true,
      "evidence_refs": [
        {
          "content_sha256": "2222222222222222222222222222222222222222222222222222222222222222",
          "proof_class": "signed_fixture",
          "ref": "fixture:evidence:2"
        }
      ],
      "exclusion_reason": null,
      "record_id": "seed-02",
      "row_sha256": "2222222222222222222222222222222222222222222222222222222222222222"
    },
    {
      "actor_slot": "Hermes",
      "eligible": true,
      "evidence_refs": [
        {
          "content_sha256": "3333333333333333333333333333333333333333333333333333333333333333",
          "proof_class": "signed_fixture",
          "ref": "fixture:evidence:3"
        }
      ],
      "exclusion_reason": null,
      "record_id": "seed-03",
      "row_sha256": "3333333333333333333333333333333333333333333333333333333333333333"
    },
    {
      "actor_slot": "Hermes",
      "eligible": true,
      "evidence_refs": [
        {
          "content_sha256": "4444444444444444444444444444444444444444444444444444444444444444",
          "proof_class": "signed_fixture",
          "ref": "fixture:evidence:4"
        }
      ],
      "exclusion_reason": null,
      "record_id": "seed-04",
      "row_sha256": "4444444444444444444444444444444444444444444444444444444444444444"
    },
    {
      "actor_slot": "Hermes",
      "eligible": true,
      "evidence_refs": [
        {
          "content_sha256": "5555555555555555555555555555555555555555555555555555555555555555",
          "proof_class": "signed_fixture",
          "ref": "fixture:evidence:5"
        }
      ],
      "exclusion_reason": null,
      "record_id": "seed-05",
      "row_sha256": "5555555555555555555555555555555555555555555555555555555555555555"
    },
    {
      "actor_slot": "Hermes",
      "eligible": true,
      "evidence_refs": [
        {
          "content_sha256": "6666666666666666666666666666666666666666666666666666666666666666",
          "proof_class": "signed_fixture",
          "ref": "fixture:evidence:6"
        }
      ],
      "exclusion_reason": null,
      "record_id": "seed-06",
      "row_sha256": "6666666666666666666666666666666666666666666666666666666666666666"
    },
    {
      "actor_slot": "Hermes",
      "eligible": true,
      "evidence_refs": [
        {
          "content_sha256": "7777777777777777777777777777777777777777777777777777777777777777",
          "proof_class": "signed_fixture",
          "ref": "fixture:evidence:7"
        }
      ],
      "exclusion_reason": null,
      "record_id": "seed-07",
      "row_sha256": "7777777777777777777777777777777777777777777777777777777777777777"
    },
    {
      "actor_slot": "Hermes",
      "eligible": true,
      "evidence_refs": [
        {
          "content_sha256": "8888888888888888888888888888888888888888888888888888888888888888",
          "proof_class": "signed_fixture",
          "ref": "fixture:evidence:8"
        }
      ],
      "exclusion_reason": null,
      "record_id": "seed-08",
      "row_sha256": "8888888888888888888888888888888888888888888888888888888888888888"
    },
    {
      "actor_slot": "Hermes",
      "eligible": true,
      "evidence_refs": [
        {
          "content_sha256": "9999999999999999999999999999999999999999999999999999999999999999",
          "proof_class": "signed_fixture",
          "ref": "fixture:evidence:9"
        }
      ],
      "exclusion_reason": null,
      "record_id": "seed-09",
      "row_sha256": "9999999999999999999999999999999999999999999999999999999999999999"
    },
    {
      "actor_slot": "Hermes",
      "eligible": true,
      "evidence_refs": [
        {
          "content_sha256": "aaaaaaaaaaaaaaaaaaaaaaaaaaaaaaaaaaaaaaaaaaaaaaaaaaaaaaaaaaaaaaaa",
          "proof_class": "signed_fixture",
          "ref": "fixture:evidence:10"
        }
      ],
      "exclusion_reason": null,
      "record_id": "seed-10",
      "row_sha256": "aaaaaaaaaaaaaaaaaaaaaaaaaaaaaaaaaaaaaaaaaaaaaaaaaaaaaaaaaaaaaaaa"
    },
    {
      "actor_slot": "Hermes",
      "eligible": true,
      "evidence_refs": [
        {
          "content_sha256": "bbbbbbbbbbbbbbbbbbbbbbbbbbbbbbbbbbbbbbbbbbbbbbbbbbbbbbbbbbbbbbbb",
          "proof_class": "signed_fixture",
          "ref": "fixture:evidence:11"
        }
      ],
      "exclusion_reason": null,
      "record_id": "seed-11",
      "row_sha256": "bbbbbbbbbbbbbbbbbbbbbbbbbbbbbbbbbbbbbbbbbbbbbbbbbbbbbbbbbbbbbbbb"
    },
    {
      "actor_slot": "Hermes",
      "eligible": true,
      "evidence_refs": [
        {
          "content_sha256": "cccccccccccccccccccccccccccccccccccccccccccccccccccccccccccccccc",
          "proof_class": "signed_fixture",
          "ref": "fixture:evidence:12"
        }
      ],
      "exclusion_reason": null,
      "record_id": "seed-12",
      "row_sha256": "cccccccccccccccccccccccccccccccccccccccccccccccccccccccccccccccc"
    },
    {
      "actor_slot": "Hermes",
      "eligible": true,
      "evidence_refs": [
        {
          "content_sha256": "dddddddddddddddddddddddddddddddddddddddddddddddddddddddddddddddd",
          "proof_class": "signed_fixture",
          "ref": "fixture:evidence:13"
        }
      ],
      "exclusion_reason": null,
      "record_id": "seed-13",
      "row_sha256": "dddddddddddddddddddddddddddddddddddddddddddddddddddddddddddddddd"
    },
    {
      "actor_slot": "Hermes",
      "eligible": true,
      "evidence_refs": [
        {
          "content_sha256": "eeeeeeeeeeeeeeeeeeeeeeeeeeeeeeeeeeeeeeeeeeeeeeeeeeeeeeeeeeeeeeee",
          "proof_class": "signed_fixture",
          "ref": "fixture:evidence:14"
        }
      ],
      "exclusion_reason": null,
      "record_id": "seed-14",
      "row_sha256": "eeeeeeeeeeeeeeeeeeeeeeeeeeeeeeeeeeeeeeeeeeeeeeeeeeeeeeeeeeeeeeee"
    },
    {
      "actor_slot": "Hermes",
      "eligible": true,
      "evidence_refs": [
        {
          "content_sha256": "ffffffffffffffffffffffffffffffffffffffffffffffffffffffffffffffff",
          "proof_class": "signed_fixture",
          "ref": "fixture:evidence:15"
        }
      ],
      "exclusion_reason": null,
      "record_id": "seed-15",
      "row_sha256": "ffffffffffffffffffffffffffffffffffffffffffffffffffffffffffffffff"
    },
    {
      "actor_slot": "Hermes",
      "eligible": true,
      "evidence_refs": [
        {
          "content_sha256": "0000000000000000000000000000000000000000000000000000000000000000",
          "proof_class": "signed_fixture",
          "ref": "fixture:evidence:16"
        }
      ],
      "exclusion_reason": null,
      "record_id": "seed-16",
      "row_sha256": "0000000000000000000000000000000000000000000000000000000000000000"
    },
    {
      "actor_slot": "Hermes",
      "eligible": true,
      "evidence_refs": [
        {
          "content_sha256": "1111111111111111111111111111111111111111111111111111111111111111",
          "proof_class": "signed_fixture",
          "ref": "fixture:evidence:17"
        }
      ],
      "exclusion_reason": null,
      "record_id": "seed-17",
      "row_sha256": "1111111111111111111111111111111111111111111111111111111111111111"
    },
    {
      "actor_slot": "Hermes",
      "eligible": true,
      "evidence_refs": [
        {
          "content_sha256": "2222222222222222222222222222222222222222222222222222222222222222",
          "proof_class": "signed_fixture",
          "ref": "fixture:evidence:18"
        }
      ],
      "exclusion_reason": null,
      "record_id": "seed-18",
      "row_sha256": "2222222222222222222222222222222222222222222222222222222222222222"
    },
    {
      "actor_slot": "Hermes",
      "eligible": true,
      "evidence_refs": [
        {
          "content_sha256": "3333333333333333333333333333333333333333333333333333333333333333",
          "proof_class": "signed_fixture",
          "ref": "fixture:evidence:19"
        }
      ],
      "exclusion_reason": null,
      "record_id": "seed-19",
      "row_sha256": "3333333333333333333333333333333333333333333333333333333333333333"
    },
    {
      "actor_slot": "Hermes",
      "eligible": true,
      "evidence_refs": [
        {